<?xml version="1.0" encoding="UTF-8"?>
<Tree xmlns="http://www.platform.com/gui/pmc_tree" xmlns:xsi="http://www.w3.org/2001/XMLSchema-instance"
	xsi:schemaLocation="http://www.platform.com/gui/pmc_tree pmc_tree.xsd">
	<TreeItem id="workloadTreeSource">
		<Nodes>
			<Node id="lsf" label="@{pmc.tree.node.lsf.label}" icon="" status="" url=""
				layoutSourceId="" tabGroup="" highlightTabId="" aclResource="Batch_job_info"
				aclPermission="1">
				<Nodes>
					<Node id="lsfJob" label="@{pmc.tree.node.lsfJob.label}" icon="" status=""
						url="" layoutSourceId="lsfJobLayout"
						tabGroup="" highlightTabId="" aclResource="Batch_job_info"
						aclPermission="1">
					</Node>
				</Nodes>
			</Node>
			<Node id="ego" label="@{pmc.tree.node.ego.label}" icon="" status="" url=""
				layoutSourceId="" tabGroup="" highlightTabId="" aclResource="Main_service"
				aclPermission="1">
				<Nodes>
					<Node id="egoService" label="@{pmc.tree.node.egoService.label}" icon="" status=""
						url="" layoutSourceId="egoServiceLayout" tabGroup=""
						highlightTabId="" aclResource="Main_service" aclPermission="1">
					</Node>
					<Node id="egoProfile" label="@{pmc.tree.node.egoProfile.label}" icon="" status=""
						url="" layoutSourceId="egoProfileLayout" tabGroup=""
						highlightTabId="" aclResource="Main_service" aclPermission="1">
					</Node>
				</Nodes>
			</Node>
		</Nodes>
	</TreeItem>

	<TreeItem id="resourceTreeSource">
		<Nodes>
			<Node id="host" label="@{pmc.tree.node.resource.label}" icon="" status="" url=""
				layoutSourceId="" tabGroup="" highlightTabId="" aclResource="Main_host"
				aclPermission="1">
				<Nodes>
					<Node id="hostListIcon" label="@{pmc.tree.node.hostListIcon.label}" icon=""
						status="" url="" layoutSourceId="resourceHostLayout" tabGroup=""
						highlightTabId="" aclResource="Main_host" aclPermission="1">
					</Node>
				   <Node id="allHostList" label="@{pmc.tree.node.allHostList.label}" icon="" 
				       status="" url="" layoutSourceId="allHostLayout"
					tabGroup="" highlightTabId="" aclResource="Main_host"
					aclPermission="1">
				   </Node>
				</Nodes>
			</Node>
            <Node id="consumer" label="@{pmc.tree.node.consumer.label}" icon="" status="" url=""
                layoutSourceId="consumerListLayout" tabGroup="" highlightTabId=""
                aclResource="Consumer_plan_consumer" aclPermission="1">
            </Node>
			<Node id="resourcePlan_slot" label="@{pmc.tree.node.resourceGroup.label}" icon="" status=""
				url="" layoutSourceId="" tabGroup="" highlightTabId=""
				aclResource="Consumer_plan_consumer" aclPermission="1">
				<Nodes>
					<Node id="rg" label="@{pmc.tree.node.subResourceGroup.label}" icon="" status="" url=""
						layoutSourceId="resourceGroupLayout" tabGroup="" highlightTabId=""
						aclResource="Main_rGroup" aclPermission="1">
					</Node>
					<Node id="resourcePlanSchedule" label="@{pmc.tree.node.resourcePlan.label}" icon=""
						status="" url="" layoutSourceId="resourcePlanLayout" tabGroup=""
						highlightTabId="" aclResource="Consumer_plan_resourceplan"
						aclPermission="1">
					</Node>
					<Node id="resourceAllocation" label="@{pmc.tree.node.resourceAllo.label}"
						icon="" status="" url="" layoutSourceId="resourceAlloLayout"
						tabGroup="" highlightTabId="" aclResource="Consumer_plan_allocationResource"
						aclPermission="1">
					</Node>
					<Node id="resourceMDSAllocation" label="@{pmc.tree.node.resourceMDSAllo.label}"
						icon="" status="" url="" layoutSourceId="resourceMDSAlloLayout"
						tabGroup="" highlightTabId="" aclResource="Consumer_plan_allocationResource"
						aclPermission="1">
					</Node>
				</Nodes>
			</Node>
			<Node id="resourcePlan_mds" label="@{pmc.tree.node.resourceGroupMDS.label}" icon="" status=""
                url="" layoutSourceId="" tabGroup="" highlightTabId=""
                aclResource="Consumer_plan_consumer" aclPermission="1">
                <Nodes>
                    <Node id="mdsrg" label="@{pmc.tree.node.mdsResourceGroup.label}" icon="" status="" url=""
                        layoutSourceId="mdsResourceGroupLayout" tabGroup="" highlightTabId=""
                        aclResource="Main_rGroup" aclPermission="1">
                    </Node>
                    <Node id="MDSResourcePlan" label="@{pmc.tree.node.MDSResourcePlan.label}" icon="" status="" url=""
                        layoutSourceId="MDSResourcePlanLayout" tabGroup="" highlightTabId=""
                        aclResource="Consumer_plan_activeResourcePlan" aclPermission="1">
                    </Node>
                </Nodes>
            </Node>
			<Node id="servicePackage" label="@{pmc.tree.node.servicePackage.label}" icon=""
				status="" url="" layoutSourceId="" tabGroup="" highlightTabId=""
				aclResource="ServicePackageListView" aclPermission="1">
				<Nodes>
					<Node id="repositoryPackage" label="@{pmc.tree.node.repositoryRegion.label}"
						icon="" status="" url="" layoutSourceId="serviceRegionLayout"
						tabGroup="" highlightTabId="" aclResource="Main_RS_Region"
						aclPermission="1">
					</Node>
				</Nodes>
			</Node>
		</Nodes>
	</TreeItem>

	<TreeItem id="systemTreeSource">
		<Nodes>
			<Node id="entitlement" label="@{pmc.tree.node.entitlement.label}" status=""
				url="" layoutSourceId="entitlementLayout" tabGroup=""
				highlightTabId="" aclResource="Main_clusterSetting_license"
				aclPermission="1" />
			<Node id="cluster" label="@{pmc.tree.node.cluster.label}" status="" url=""
				layoutSourceId="" tabGroup="" highlightTabId="" aclResource="Main_clusterSetting"
				aclPermission="1">
				<Nodes>
					<Node id="summary" label="@{pmc.tree.node.summary.label}" icon="" status="" url=""
						layoutSourceId="clusterSummaryLayout" tabGroup="" highlightTabId=""
						aclResource="Main_clusterSetting_summary" aclPermission="1">
					</Node>
					<Node id="properties" label="@{pmc.tree.node.property.label}" icon="" status=""
						url="" layoutSourceId="clusterPropertyLayout" tabGroup=""
						highlightTabId="" aclResource="Main_clusterSetting_user"
						aclPermission="1">
					</Node>
					<Node id="masterFailover" label="@{pmc.tree.node.masterFailover.label}" icon=""
						status="" url="" layoutSourceId="masterFailoverLayout" tabGroup=""
						highlightTabId="Main_clusterSetting_mastercandidate" aclResource=""
						aclPermission="1">
					</Node>
				</Nodes>
			</Node>
			<Node id="user" label="@{pmc.tree.node.user.label}" status="" url="" layoutSourceId=""
				tabGroup="" highlightTabId="" aclResource="Main_user" aclPermission="1">
				<Nodes>
					<Node id="account" label="@{pmc.tree.node.account.label}" icon="" status="" url=""
						layoutSourceId="userAccountsLayout" tabGroup="" highlightTabId=""
						aclResource="Main_user" aclPermission="1">
					</Node>
					<Node id="role" label="@{pmc.tree.node.role.label}" icon="" status="" url=""
						layoutSourceId="userRoleLayout" tabGroup="" highlightTabId=""
						aclResource="Main_user_role" aclPermission="1">
					</Node>
				</Nodes>
			</Node>
		</Nodes>
	</TreeItem>

	<TreeItem id="eventAndReportTreeSource">
		<Nodes>
			<Node id="standardReport" label="@{pmc.tree.node.standarReport.label}" status=""
				url="" layoutSourceId="standarReportLayout" tabGroup=""
				highlightTabId="" aclResource="Main_perf_standard" aclPermission="1" />
			<Node id="customReport" label="@{pmc.tree.node.customerReport.label}" status="" url=""
				layoutSourceId="customReportLayout" tabGroup="" highlightTabId=""
				aclResource="Main_perf_custom" aclPermission="1" />
			<Node id="systemLog" label="@{pmc.tree.node.systemLog.label}" status="" url=""
				layoutSourceId="systemReportLayout" tabGroup="" highlightTabId=""
				aclResource="Main_logretrieve" aclPermission="1" />
			<Node id="explorerReport" label="@{pmc.tree.node.explorerReport.label}" status="" url=""
				layoutSourceId="" tabGroup="" highlightTabId="" aclResource="Main_explorer_report"
				aclPermission="1">
				<Nodes>
					<Node id="explorerDashboard" label="@{pmc.tree.node.explorerDashboard.label}" icon="" status="" url=""
						layoutSourceId="explorerDashboardLayout" tabGroup="" highlightTabId=""
						aclResource="Main_explorer_report" aclPermission="1">
					</Node>
					<Node id="explorerChart" label="@{pmc.tree.node.explorerChart.label}" icon="" status=""
						url="" layoutSourceId="explorerChartLayout" tabGroup=""
						highlightTabId="" aclResource="Main_explorer_report"
						aclPermission="1">
					</Node>
				</Nodes>
			</Node>
		</Nodes>
	</TreeItem>

	<TreeItem id="harvesting">
		<Nodes>
			<Node id="harvestingHost" label="@{pmc.tree.node.harvestiong.host.label}" status="" url=""
				layoutSourceId="harvestingHostLayout" tabGroup="" highlightTabId=""
				aclResource="Main_harvesting_host" aclPermission="1" />
			<Node id="configure" label="@{pmc.tree.node.harvestiong.conf.label}" status="" url=""
				layoutSourceId="harvestingConfLayout" tabGroup="" highlightTabId=""
				aclResource="Main_harvesting_conf" aclPermission="1" />
			<Node id="vmResources" label="@{pmc.tree.node.harvestiong.vmResource.label}" status=""
				url="" layoutSourceId="harvestingVMResourceLayout" tabGroup=""
				highlightTabId="" aclResource="Main_harvesting_host" aclPermission="1" />
		</Nodes>
	</TreeItem>
</Tree>
