<?xml version="1.0" encoding="UTF-8"?>
<Tree xmlns="http://www.platform.com/gui/pmc_tree" xmlns:xsi="http://www.w3.org/2001/XMLSchema-instance"
	xsi:schemaLocation="http://www.platform.com/gui/pmc_tree pmc_tree.xsd">
	<TreeItem id="workloadTreeSource">
		<Nodes>
			<Node id="symphony" label="@{pmc.tree.node.symphony.label}" icon="" status="" url=""
				layoutSourceId="" tabGroup="" highlightTabId="" aclResource="Main_SOAM"
				aclPermission="1">
				<Nodes>
					<Node id="symphonyApp" label="@{pmc.tree.node.applications.label}" icon="" status=""
						url="" layoutSourceId="applicationLayout" tabGroup=""
						highlightTabId="applicationLayout" aclResource="Main_session"
						aclPermission="1">
					</Node>
					<Node id="profile" label="@{pmc.tree.node.appProfiles.label}" icon=""
						status="" url="" layoutSourceId="symAppProfileLayout" tabGroup=""
						highlightTabId="symAppProfileLayout" aclResource="Configuration"
						aclPermission="1">
					</Node>
					<Node id="deprofile" label="@{pmc.tree.node.appProfiles.label}" icon=""
						status="" url="" layoutSourceId="desymAppProfileLayout" tabGroup=""
						highlightTabId="symAppProfileLayout" aclResource="Configuration"
						aclPermission="1">
					</Node>
				</Nodes>
			</Node>
		</Nodes>
	</TreeItem>

	<TreeItem id="resourceTreeSource">
		<Nodes>
			<Node id="servicePackage" label="@{pmc.tree.node.servicePackage.label}" icon=""
				status="" url="" layoutSourceId="" tabGroup="" highlightTabId=""
				aclResource="ServicePackageListView" aclPermission="1">
				<Nodes>
					<Node id="symServicePackage" label="@{pmc.tree.node.symServicePackage.label}"
						icon="" status="" url="" layoutSourceId="servicePackageLayout"
						tabGroup="" highlightTabId="" aclResource="ServicePackageListView"
						aclPermission="1">
					</Node>
					<Node id="desymServicePackage" label="@{pmc.tree.node.symServicePackage.label}"
						icon="" status="" url="" layoutSourceId="deservicePackageLayout"
						tabGroup="" highlightTabId="" aclResource="ServicePackageListView"
						aclPermission="1" helpGroupId="symServicePackages">
					</Node>
				</Nodes>
			</Node>
		</Nodes>
	</TreeItem>
</Tree>
